{
  "csl": "1.2",
  "meta": {"name": "Assembly Slider Demo", "units": "mm"},
  "sketches": [
    {"id":"base_sk","plane":"world.xy","entities":[{"kind":"rect","id":"plate","p1":"0,0","p2":"80 mm,40 mm"}]},
    {"id":"cart_sk","plane":"world.xy","entities":[{"kind":"rect","id":"car","p1":"-10 mm,-5 mm","p2":"10 mm,5 mm"}]}
  ],
  "features": [
    {"kind":"extrude","id":"base_ex","profile":"plate","distance":"6 mm","op":"new_solid","result":"part"},
    {"kind":"extrude","id":"cart_ex","profile":"car","distance":"10 mm","op":"new_solid","result":"part"}
  ],
  "assemblies": [
    {
      "id": "A",
      "instances": [
        {"id":"base","of":"created_by('base_ex')"},
        {"id":"cart","of":"created_by('cart_ex')","at":{"transform":{"translate":"0 mm,0 mm,6 mm"}}}
      ],
      "joints": [
        {"id":"j_slider","type":"slider","between":["cart","base"],"axis":"world.x","limits":{"linear":{"min":"0 mm","max":"50 mm"}},"damping":0.1,"preload":"0 N"}
      ]
    }
  ],
  "export": [
    {"id":"asm","format":"STEP","path":"out/assembly_slider_demo.step","target":"assembly"}
  ]
}


